{
  "$schema": "https://json-schema.org/draft/2020-12/schema",
  "$id": "https://github.com/cuioss/plan-marshall-mcp/test/model/verification/schema/verification-item.schema.json",
  "title": "PM-MCP model verification item",
  "description": "One verification task for a model role: what the model sees (input), the reference answer (target), how an answer is graded, where the case comes from, who reviewed the reference, and contamination notes. Field names follow the sample model of Inspect AI (id, input, target, choices, metadata) where they overlap. Results are never stored in an item.",
  "type": "object",
  "additionalProperties": false,
  "required": ["schema_version", "id", "topic", "role", "title", "input", "target", "grading", "provenance", "review", "canary"],
  "properties": {
    "$schema": {"type": "string"},
    "schema_version": {"const": 1},
    "id": {"type": "string", "pattern": "^[a-z0-9][a-z0-9-]*(/[a-z0-9][a-z0-9-]*)+$", "description": "<topic path>/<slug>; equals the file path below the corpus root without .json"},
    "topic": {"type": "string", "pattern": "^[a-z0-9-]+(/[a-z0-9-]+)*$", "description": "the directory of the item"},
    "role": {"type": "string", "description": "the configured role that answers the item (doc/concepts/harness-as-worker/roles.adoc#configuration)"},
    "title": {"type": "string", "maxLength": 120},
    "tags": {"type": "array", "items": {"type": "string"}},
    "group": {"type": "string", "description": "items that share one case (for example the split and combined forms of a self-review)"},
    "input": {
      "type": "object",
      "additionalProperties": false,
      "required": ["question", "facts"],
      "properties": {
        "question": {"type": "string"},
        "facts": {"type": "string", "description": "exactly the text the model sees besides the question; complete repository-relative paths"},
        "choices": {"type": ["array", "null"], "items": {"type": "string"}, "minItems": 2},
        "answer_schema": {"type": ["object", "null"], "description": "the JSON Schema of an open answer"}
      }
    },
    "target": {
      "type": "object",
      "additionalProperties": false,
      "required": ["rationale"],
      "properties": {
        "answer": {"description": "a choice, a label, or the expected action of an open answer"},
        "rationale": {"type": "string"},
        "alternatives": {"type": "array", "items": {"type": "string"}, "description": "other answers the reviewer accepts"},
        "items": {
          "type": "array",
          "description": "rubric items an open answer must meet: seeded defects or essential properties",
          "items": {
            "type": "object",
            "additionalProperties": false,
            "required": ["id", "description"],
            "properties": {
              "id": {"type": "string"},
              "description": {"type": "string"},
              "location": {"type": "string", "description": "file:line in the new code, where it applies"},
              "applies_to": {"type": "array", "items": {"type": "string"}, "description": "which questions of a split review the item belongs to"}
            }
          }
        },
        "expected_empty": {"type": "boolean", "description": "a control: the correct answer reports nothing"}
      }
    },
    "grading": {
      "type": "object",
      "additionalProperties": false,
      "required": ["method"],
      "properties": {
        "method": {"enum": ["exact_choice", "label", "rubric_items", "rubric_properties"], "description": "exact_choice and label compare the answer with target.answer; rubric_items scores the share of target.items found (a control scores 1 only when empty); rubric_properties scores the share of target.items met"},
        "judge": {"type": "string", "description": "the judge instruction or model, for rubric methods"},
        "pass_threshold": {"type": "number", "minimum": 0, "maximum": 1}
      }
    },
    "provenance": {
      "type": "object",
      "additionalProperties": false,
      "required": ["kind", "created"],
      "properties": {
        "kind": {"enum": ["extracted", "hand-made", "fetched", "written"]},
        "source": {"description": "where the case comes from: archived plan, file, log hash, URL"},
        "created": {"type": "string", "format": "date"},
        "created_by": {"type": "string"},
        "derived_from": {"type": "string", "description": "the earlier fixture id"}
      }
    },
    "review": {
      "type": "object",
      "additionalProperties": false,
      "required": ["status"],
      "properties": {
        "status": {"enum": ["draft", "confirmed", "contested", "retired"]},
        "by": {"type": "string"},
        "date": {"type": "string", "format": "date"},
        "notes": {"type": "string"}
      }
    },
    "contamination": {"type": "string", "description": "what in this or another item gives the answer away, and which items must not share a session"},
    "canary": {"type": "string", "description": "the corpus canary GUID; a model that reproduces it has seen the corpus"}
  }
}
